date_start,date_end,event
2011-01-01,,"Эстония перешла на евро, став 17-м членом еврозоны."
2011-01-01,,Венгрия стала государством-председателем Совета Европейского союза.
2011-01-01,,"Специальные муниципалитеты Нидерландов: Бонайре, Синт-Эстатиус и Саба (Карибские Нидерланды) перешли с антильского гульдена на доллар США."
2011-01-01,,Литва стала государством-председателем ОБСЕ.
2011-01-01,,В России запрещена продажа ламп накаливания мощностью 100 ватт и более.
2011-01-01,,Дилма Русеф вступила в должность президента Бразилии (первая женщина-президент в истории страны).
2011-01-01,,"Взрыв в коптской церкви в Александрии (Египет). Погибли 23 человека, ранены 97 человек."
2011-01-01,,"В Сургуте (Россия) при взлёте загорелся и взорвался самолёт Ту-154. 3 человека погибли, 44 пострадали."
2011-01-02,,"В чили произошло землетрясение магнитудой 6,5. жертв и разрушений нет."
2011-01-07,,В омске прошёл xx рождественский марафон.
2011-01-08,,"В городе тусон (сша) во время выступления перед избирателями совершено покушение на члена палаты представителей сша от штата аризона габриэль гиффордс, которая с тяжёлым ранением головы доставлена в госпиталь. погибли 6, ранены 14 человек."
2011-01-09,,В Российской Федерации запрещена покупка иностранцами земель на приграничных территориях.
2011-01-09,,В результате авиакатастрофы в Иране погибли 77 и ранены 26 человек.
2011-01-09,2011-01-15,референдум в Южном Судане о независимости от Судана.
2011-01-10,,Южная осетия полностью запретила хождение на своей территории грузинского лари.
2011-01-13,2011-01-16,"9-й международный фестиваль духовной музыки «Серебряные колокола» (Даугавпилс, Латвия)."
2011-01-14,,"Парламент Казахстана принял решение о проведении референдума о продлении полномочий президента страны Нурсултана Назарбаева до 2020 года, вопреки его указу об отклонении данного предложения."
2011-01-14,,Государственный переворот в Тунисе. В результате волнений в Тунисе президент Туниса Зин эль-Абидин Бен Али бежал из страны.
2011-01-16,,"Российская команда «камаз-мастер» в десятый раз стала победительницей ралли дакар 2011 (буэнос-айрес, аргентина)."
2011-01-17,,Президент казахстана нурсултан назарбаев не подписал поправки в конституцию о проведении референдума по продлению его полномочий до 2020 года и направил их на рассмотрение в конституционный совет.
2011-01-19,,"Землетрясение магнитудой 7,4 произошло на юго-западе Пакистана."
2011-01-19,,В России впервые возбуждено уголовное дело в отношении интернет-пользователя по факту нарушения авторских прав.
2011-01-20,,"В городе макеевка (донецкая область, украина) произошло несколько взрывов. пострадавших нет."
2011-01-21,,Александр Лукашенко официально вступил в должность президента Республики Беларусь в четвёртый раз.
2011-01-21,,Массовое убийство в Ставрополе.
2011-01-23,,На президентских выборах в Португалии победил действующий глава государства Анибал Каваку Силва.
2011-01-23,,"На юге Пакистана пассажирский автобус столкнулся с бензовозом. Погибли 32 человека, 9 пострадали."
2011-01-24,,"В результате теракта в аэропорту домодедово погибли 37, ранены 180 человек."
2011-01-25,,Государственная дума России окончательно ратифицировала договор об СНВ-3.
2011-01-25,,Начало массовых антиправительственных выступлений в Египте против режима Хосни Мубарака.
2011-01-26,2011-01-30,"41-й Всемирный экономический форум (Давос, Швейцария)."
2011-01-27,2011-02-06,"25-я зимняя Универсиада (Эрзурум, Турция)."
2011-01-28,,Государственная дума россии приняла закон «о полиции».
2011-01-29,,В результате волнений в египте мародёры уничтожили две мумии египетских фараонов и пытались разгромить редчайшую коллекцию египетских древностей в национальном музее в центре каира.
2011-01-30,,"Сша призвали своих граждан покинуть египет «быстро, насколько возможно»."
2011-01-30,2011-02-06,"VII Зимние Азиатские игры (Азиада-2011) (Астана, Казахстан)."
2011-01-31,,"Конституционный совет республики казахстан, рассмотрев обращение президента страны, признал незаконным проведение референдума по продлению его полномочий до 2020 года. нурсултан назарбаев согласился с этим решением и предложил провести досрочные президентские выборы."
2011-02-01,,В екатеринбурге в день 80-летия со дня рождения первого президента россии состоялось открытие памятника борису ельцину.
2011-02-02,2011-02-04,"Архиерейский собор Русской православной церкви (Храм Христа Спасителя, Москва, Россия)."
2011-02-03,,"Президент рф дмитрий медведев упразднил федеральную службу по надзору за соблюдением законодательства в области охраны культурного наследия, подписав соответствующий указ."
2011-02-05,,Вступил в силу договор об снв-3.
2011-02-06,,"В арлингтоне (штат техас, сша) прошёл супербоул xlv."
2011-02-07,,Президент Судана Омар аль-Башир признал независимость Южного Судана.
2011-02-07,,Президент РФ Дмитрий Медведев подписал федеральный закон «О полиции».
2011-02-08,,Президент рф дмитрий медведев объявил об отмене в россии перехода на «зимнее время».
2011-02-09,,Отмена визового режима между украиной и израилем.
2011-02-09,2011-02-13,"международный авиационно-космический салон Aero India (Аэро Индия) (Бангалор, Индия)."
2011-02-10,,"Пожар на складе ооо «кама-трейд» в перми, в результате которого 18 человек погибли, двое ранены, 1 — спасся."
2011-02-11,,Президент египта хосни мубарак покинул свой пост.
2011-02-13,,В Чаде прошли парламентские выборы.
2011-02-13,,Высший совет Вооружённых сил Египта отменил действие конституции в стране и распустил обе палаты парламента.
2011-02-15,,"Американский межпланетный зонд Stardust-NeXT совершил пролёт вблизи поверхности кометы Tempel 1, минимальное расстояние до небесного тела составляло 181 км."
2011-02-15,,Начало гражданской войны в Ливии между сторонниками и противниками Муамара Каддафи.
2011-02-17,,"Во Вьетнаме затонуло судно с иностранными туристами. Погибли 11 человек, из них две гражданки России."
2011-02-17,,Дмитрий Медведев встретился с папой римским Бенедиктом XVI.
2011-02-17,,В Кыргызстане появился пик Владимира Путина.
2011-02-18,,"В Кабардино-Балкарии обстрелян автобус с московскими туристами. Трое туристов погибли, двое ранены."
2011-02-18,,Южно-Африканская Республика официально присоединилась к группе развивающихся государств БРИК.
2011-02-20,,В городе хаапсалу (эстония) произошёл пожар в детском доме для инвалидов. погибли 10 детей.
2011-02-22,,Перу и Ливия расторгли дипломатические отношения в связи с беспорядками в Ливии.
2011-02-22,,"В результате разрушительного землетрясения в Крайстчерче (Новая Зеландия) магнитудой 6,3 погибли 166 человек, 122 — пропали без вести."
2011-02-23,,"Президент россии дмитрий медведев вручил мэрам городов тихвин, тверь и владивосток грамоты о присвоении звания город воинской славы."
2011-02-24,,"133-й старт (STS-133) по программе Спейс Шаттл. 39-й полёт шаттла Дискавери. Экипаж — Стивен Линдси, Эрик Боу, Элвин Дрю, Майкл Барратт, Стивен Боуэн, Николь Стотт. Продолжение строительства Международной космической станции. Последний полёт шаттла Дискавери."
2011-02-24,,Крупнейший аэропорт мира Аль-Мактум в Дубае открыт для пассажирских лайнеров.
2011-02-27,,В лос-анджелесе (сша) состоялась 83-я церемония вручения премий оскар. лучшим фильмом года американская киноакадемия признала картину «король говорит!».
2011-02-28,,"В японии завершился первый в мире марафонский забег, участие в котором принимали роботы."
2011-03-01,,В России вступил в силу закон «О полиции».
2011-03-01,,В России начали действовать водительские права международного образца.
2011-03-01,,"Упрощён визовый режим между Грузией и ЕС (кроме Дании, Великобритании и Ирландии)."
2011-03-04,,"Президентом торгово-промышленной палаты россии избран сергей катырин после того, как 21 февраля её предыдущий президент евгений примаков объявил о своей отставке и об отказе от переизбрания на новый срок."
2011-03-06,,"В Эстонии прошли парламентские выборы. Победу одержала Партия реформ, которую возглавляет премьер-министр Эстонии Андрус Ансип."
2011-03-06,,В Техасе (США) прошли крупные митинги за независимость штата.
2011-03-07,,Президент России Дмитрий Медведев подписал закон о либерализации уголовного законодательства.
2011-03-07,,В столице Анголы Луанде разогнана антиправительственная демонстрация во главе с рэпером Иконокластой.
2011-03-09,,"Официально введён в эксплуатацию суперкомпьютер, построенный в РФЯЦ-ВНИИЭФ — самый мощный, на сегодняшний день, суперкомпьютер в России."
2011-03-09,,"Шатл «Дискавери» завершил свою 27-летнюю карьеру, совершив успешное приземление в космическом центре имени Кеннеди во Флориде."
2011-03-11,,"Землетрясение магнитудой от 9,0 до 9,1 произошло у северо-восточного побережья японии. землетрясение вызвало разрушительное цунами в японии. высота волны достигала 10 м. произошли сбои в работе нескольких ядерных реакторов. 15 597 погибших, 5694 раненых, 4980 пропавших без вести (на 20 июля). экономический ущерб, по приблизительной оценке, составил до 309 млрд usd."
2011-03-12,,"На японской аэс «фукусима-1», пострадавшей в результате землетрясения, произошёл взрыв. уровень радиации возле станции превысил норму в 20 раз."
2011-03-13,,Единый день голосования (Россия).
2011-03-13,,Колумбия отменила визовый режим для граждан России.
2011-03-14,,В бахрейн прибыли больше тысячи военнослужащих из саудовской аравии и полицейские силы из оаэ.
2011-03-15,,На АЭС Фукусима I произошли взрывы во втором и четвёртом энергоблоках. На четвёртом энергоблоке пожар.
2011-03-15,,Начало гражданской войны в Сирии.
2011-03-16,,"Приземление космического корабля союз тма-01м. экипаж посадки — александр калери, олег скрипочка и скотт келли (сша)."
2011-03-18,,Автоматическая межпланетная станция MESSENGER вышла на орбиту Меркурия.
2011-03-18,,Автоматическая межпланетная станция New Horizons пересекла орбиту Урана после пятилетнего путешествия.
2011-03-19,,В Египте прошёл референдум по внесению изменений в Конституцию. Большинство египтян поддержало поправки к конституции.
2011-03-19,,"Военно-воздушные силы Франции, Великобритании и США начали бомбардировки районов Ливии, находящихся под контролем сторонников Каддафи."
2011-03-20,,В гаити прошёл второй тур президентских выборов. новым президентом гаити стал мишель мартейи.
2011-03-22,,"Реактивный истребитель ввс нигерии f-7 потерпел крушение в международном аэропорту малам амину кано в кано. пилот погиб, аэропорт для совершения полётов был закрыт."
2011-03-23,,"Теракт в иерусалиме, погиб 1 человек и 35 ранены."
2011-03-24,,"Землетрясение в мьянме магнитудой 7. погибло около 60 человек, ранены не менее 90."
2011-03-24,2011-03-25,саммит ЕС.
2011-03-27,,Россия и беларусь перешли на постоянное летнее время.
2011-03-28,,Бывший президент египта хосни мубарак заключён под домашний арест.
2011-04-01,,На границе россии и беларуси отменён транспортный контроль. его перенесли на внешний контур границ таможенного союза.
2011-04-03,,На внеочередных выборах президента Казахстана Нурсултан Назарбаев переизбран на четвёртый срок.
2011-04-03,,В России вступили в силу новые правила регистрации автомобилей.
2011-04-04,,В столице ДРК городе Киншасе произошла авиакатастрофа самолёта «CRJ-100». Погибли 32 человека.
2011-04-04,,Землетрясение в Индонезии магнитудой около 7.
2011-04-05,,"С космодрома байконур запущен космический корабль союз тма-21 «юрий гагарин». экипаж старта — андрей борисенко, александр самокутяев и рональд гаран (сша)."
2011-04-07,,Атифете яхьяга избрана президентом республики косово (первая женщина-президент в истории косово).
2011-04-11,,"Экс-президент Кот-д’Ивуара Лоран Гбагбо, отказавшийся признать поражение на выборах, захвачен французским спецназом и передан представителям избранного кандидата Алассана Уаттара."
2011-04-11,,"В Минске произошёл взрыв в метро на станции «Октябрьская», погибли 15 человек, пострадали 204 человека."
2011-04-12,,Международное празднование 50-й годовщины полёта человека в космос.
2011-04-15,,"В москве прошла конференция, на которой между представителями роскосмоса и наса обсуждена возможность создания космического корабля с ядерной энергетической установкой."
2011-04-16,,Вступил в силу безвизовый режим между россией и турцией.
2011-04-17,,Парламентские выборы в Финляндии. Победу одержала партия Национальная коалиция.
2011-04-17,,VI-й съезд Коммунистической партии Кубы принял решение о серьёзных политических и экономических реформах в стране.
2011-04-17,,на телеканале HBO состоялась премьера сериала «Игра престолов».
2011-04-19,,"В Сирии принят закон об отмене чрезвычайного положения, действовавшего в стране почти полвека, и упразднён государственный суд безопасности."
2011-04-19,,"На VI съезде Компартии Кубы Фидель Кастро оставил пост Первого секретаря ЦК партии, новым Первым секретарём избран Рауль Кастро."
2011-04-25,2011-05-01,"чемпионат мира по фигурному катанию (Москва, Россия)."
2011-04-29,2011-05-15,"чемпионат мира по хоккею с шайбой (Братислава, Кошице; Словакия). Чемпионом стала сборная Финляндии."
2011-05-02,,В результате спецоперации в Пакистане уничтожен глава террористической сети Аль-Каида Усама бен Ладен.
2011-05-02,,Парламентские выборы в Канаде. Правящая Консервативная партия получила абсолютное большинство мест в парламенте.
2011-05-03,2011-05-04,"IV Астанинский экономический форум (Астана, Казахстан)."
2011-05-07,,"Городам Старый Оскол, Колпино и Анапа присвоено почётное звание Город воинской славы."
2011-05-07,,Нападение радикальных исламистов на церковь Мари-Мина в Египте. Погибли 12 человек и 232 ранены.
2011-05-10,2011-05-14,"конкурс песни «Евровидение 2011» (Дюссельдорф, Германия). Победителем стал дуэт Ell & Nikki из Азербайджана."
2011-05-15,,"Завершился 75-й чемпионат мира по хоккею с шайбой, победу одержала сборная финляндии."
2011-05-16,,"134-й старт (sts-134) по программе спейс шаттл. 25-й полёт шаттла индевор. экипаж — марк келли, грегори джонсон, эндрю фьюстел, майкл финк, грегори шамитофф, роберто виттори (италия). продолжение строительства международной космической станции. последний полёт шаттла индевор."
2011-05-17,,"Теракт в дкнб в актобе, казахстан. погиб 1 человек, пострадало 2 полицейских."
2011-05-20,2011-05-21,"ежегодное заседание ЕБРР (Астана, Казахстан)."
2011-05-24,,Дмитрий медведев подписал указ о создании агентства по защите интеллектуальной собственности.
2011-05-24,,"Приземление космического корабля союз тма-20. экипаж посадки — дмитрий кондратьев, катерина коулман (сша) и паоло несполи (италия)."
2011-05-28,,Президент латвии валдис затлерс инициировал роспуск парламента.
2011-05-31,,В москве открыт памятник поэту иосифу бродскому.
2011-06-01,,Открылась 54-я венецианская биеннале (по 27 ноября).
2011-06-03,,"Взрывы на военном складе в селе Пугачёво (Удмуртия, Россия). Пострадало около 3000 домов и квартир, госпитализированы 48 человек."
2011-06-03,,Выборы президента Латвии. Новым президентом избран Андрис Берзиньш.
2011-06-05,,Досрочные парламентские выборы в Португалии. Победила оппозиционная Социал-демократическая партия. Премьер-министр Жозе Сократеш подал в отставку.
2011-06-05,,В Перу прошёл второй тур президентских выборов. Победил левый кандидат Ольянта Умала.
2011-06-06,,В россии указом президента дмитрия медведева учреждён день русского языка.
