date_start,date_end,event
2011-12-17,,"Скончался Великий руководитель КНДР Ким Чен Ир. Должность перешла к Ким Чен Ыну, как к Высшему руководителю КНДР. К Ким Чен Ыну также перешли титулы Верховного главнокомандующего Корейской народной армии."
2011-12-18,,Последние войска сша покинули территорию ирака.
2011-12-21,,"Старт космического корабля союз тма-03м. экипаж старта — олег кононенко, андре кёйперс (нидерланды) и доналд петтит (сша)."
2011-12-25,,Второй тур выборов президента приднестровской молдавской республики. президентом избран евгений шевчук.
2011-12-29,,"Ким Чен Ын официально объявлен верховным вождём КНДР, главой партии и главнокомандующим Корейской народной армии."
2011-12-29,,"Парламентские выборы на Ямайке. По предварительным данным, победила оппозиционная Народная национальная партия. Премьер-министром Ямайки стала Поршия Симпсон-Миллер."
2011-12-31,,Начало переписи населения в эстонии.
