date_start,date_end,event
2021-10-05,,"Суд Сан-Франциско обязал компанию Tesla выплатить бывшему работнику завода компании во Фримонте (Калифорния) Оуэну Диасу 136,9 млн долларов по причине расовой дискриминации. Сумма стала крупнейшей суммой, присуждённой за расовую дискриминацию в истории."
2021-10-06,,Одобрение воз первой вакцины против малярии.
2021-10-07,,Крупное землетрясение в Пакистане. Погибло 23 человека;
2021-10-07,,Отставка Дмитрия Разумкова с поста председателя Верховной рады. Его преемником стал Руслан Стефанчук;
2021-10-07,,Присуждение Нобелевской премии по литературе танзанийцу Абдулразаку Гурна «за бескомпромиссное и сострадательное погружение в последствия колониализма и судьбу беженцев в пропасти между культурами и континентами».
2021-10-08,,Обрушение жилого дома в Батуми (Грузия). Погибло 9 человек;
2021-10-08,,Теракт в мечети Кундуза (Исламский Эмират Афганистан).
2021-10-09,,Проведение парламентских выборах в Чехии. Победа правоцентристской коалиции «SPOLU». Правящее движение премьер-министра Андрея Бабиша «ANO 2011» потерпело поражение.
2021-10-09,,Отставка австрийского федерального канцлера Себастьяна Курца.
2021-10-10,,Крушение самолёта «L-410» в Татарстане. Погибло 17 человек;
2021-10-10,,Победа сборной Франции по футболу в Лиге наций УЕФА. Сборная обыграла в финале сборную Испании.
2021-10-13,,"Массовое убийство в конгсберге, норвегия."
2021-10-14,,Остановка всех рейсов компанией «alitalia» в связи с её банкротством.
2021-10-15,2021-11-15,проведение в России основного этапа переписи населения.
2021-10-20,,Присуждение Европарламентом премии Сахарова Алексею Навальному;
2021-10-20,,Объявление в России недели выходных с 30 октября по 7 ноября (в некоторых регионах с 23 октября и возможным продлением после 7 ноября) из-за обострившейся ситуации с распространением «COVID-19» на территории России.
2021-10-22,,Взрыв на пороховом заводе в рязанской области. погибло 17 человек.
2021-10-24,,"Переизбрание 64-летнего шавката мирзиёева, в связи с получением около 80 % голосов избирателей."
2021-10-25,,Начало военных переворотов в судане.
2021-10-26,,"Выпуск компанией Джеффа Безоса «Blue Origin» пресс-релиза, в котором компания сообщила о планах строительства орбитальной станции «Орбитальный риф»;"
2021-10-26,,"Открытие президентами Азербайджана и Турции Ильхамом Алиевым и Реджепом Тайипом Эрдоганом международного аэропорта в городе Физули, который до осени 2020 года находился под контролем непризнанной Нагорно-Карабахской Республики;"
2021-10-26,,Отставка Ангелы Меркель с поста канцлера Германии. Однако Ангела Меркель продолжила исполнять обязанности до избрания нового канцлера;
2021-10-26,,Выдача первого в стране гендерно-нейтрального паспорта Госдепартаментом США.
2021-10-30,,Проведение в Грузии второго тура местных выборов;
2021-10-30,,Открытие двухдневного саммита «группы двадцати» в Риме.
2021-10-31,,Победа «Либерально-демократической партии» во главе с премьер-министром Фумио Кисидой на парламентских выборах в Японии.
2021-10-31,,"Проведение конференции ООН по изменению климата в Глазго, ранее отложенной из-за пандемии «COVID-19»."
2021-11-01,,Приостановка Россией работы своего постпредства при НАТО;
2021-11-01,,Количество умерших от COVID-19 в мире превысило 5 млн человек.
2021-11-03,,Крушение самолёта «Ан-12» под Иркутском.
2021-11-03,,Проведение выборов мэра в Нью-Йорке. Победу одержал демократ Эрик Адамс;
2021-11-05,,"Давка на astroworld festival. 10 человек погибло, 25 были госпитализированы."
2021-11-14,,Проведение президентских и парламентских выборов в болгарии. победу одержала либеральная партия «продолжаем перемены».
2021-11-21,,Проведение в Болгарии второго тура президентских выборов. Фаворитом стал действующий президент Румен Радев;
2021-11-21,,"Массовое убийство в Уокешо. Подозреваемый въехал на внедорожнике в толпу людей. 5 человек погибло, не менее 48 ранены;"
2021-11-21,,Первый тур президентских выборов в Чили.
2021-11-23,,При пожаре в туристическом автобусе в болгарии погибли 45 человек.
2021-11-24,,Уход в отставку стефана лёвена. новым премьер-министром швеции назначена магдалена андерссон.
2021-11-25,,"Взрыв на шахте «листвяжная», в результате которого погиб 51 человек."
2021-11-28,,Проведение парламентских выборов в Кыргызстане.
2021-11-28,,В Калифорнии умер глава Дома Романовых Андрей Андреевич Романов. Новым главой Дома Романовых стал его старший сын Алексей.
2021-11-30,,Становление барбадоса республикой.
2021-12-01,,Столкновения между ираном и талибами.
2021-12-01,2021-12-19,проведение чемпионата мира по гандболу среди женщин в Испании.
2021-12-04,,Полное солнечное затмение на территории антарктиды.
2021-12-05,,Землетрясение на острове ява в индонезии.
2021-12-07,,"Стрельба в многофункциональном центре на юго-востоке москвы, в результате которой погибло 2 человека, 4 ранены."
2021-12-08,,Ангела меркель окончательно сложила свои полномочия. новым федеральным канцлером германии был назначен олаф шольц.
2021-12-10,2021-12-11,"разрушительные торнадо в США, в результате которых погибло более 100 человек."
2021-12-12,,Проведение президентских выборов в приднестровье.
2021-12-13,,"Взрыв у гимназии введенского владычного монастыря в серпухове, в результате которого 13 человек получили ранения."
2021-12-19,,Проведение 19-й конкурса «Детское Евровидение 2021».
2021-12-19,,"Второй тур президентских выборов в Чили. Победу одержал кандидат от коалиции «Одобряю достоинство» — Габриэль Борич, став самым молодым избранным президентом в истории страны."
2021-12-25,,Запуск космического телескопа «джеймс уэбб».
2021-12-29,,Окончательная отмена смертной казни в казахстане.
