date_start,date_end,event
2021-01-01,,Запрет использования пластиковых пакетов в магазинах в крупных городах КНР;
2021-01-01,,Вступление в силу Африканской континентальной зоны свободной торговли;
2021-01-01,,Прекращение выдачи бумажных трудовых книжек в Российской Федерации;
2021-01-01,,Начало поставки компанией «Газпром» природного газа в Сербию и Боснию и Герцеговину по новому маршруту;
2021-01-01,,"Увеличение пенсионного возраста в Беларуси на 6 месяцев (до 62,5 лет для мужчин и до 57,5 лет для женщин);"
2021-01-01,,Полный выход Великобритании из Европейского союза;
2021-01-01,,Снижение экспортных пошлин на нефть и нефтепродукты в Беларуси;
2021-01-01,,Запрет экспорта одноразового неразлагающегося пластика в Европе.
2021-01-01,,Сенат США преодолел вето Дональда Трампа на законопроект с санкциями против «Северного потока — 2».
2021-01-02,,Откладывание Пентагоном полномасштабного производства истребителей «F-35» на неопределённый срок;
2021-01-02,,Отказ норвежской компанией «DNV GL» в сертификации газопровода «Северный поток — 2» в связи с угрозами санкций США;
2021-01-02,,"Президент Казахстана Касым-Жомарт Токаев подписал закон, направленный на отмену смертной казни в республике."
2021-01-03,,Проведение в годовщину убийства Касема Сулеймани многотысячных митингов в Багдаде и Тегеране;
2021-01-03,,Принятие Папой римским отставки главы белорусских католиков Тадеуша Кондрусевича;
2021-01-04,,Отказ Министерством просвещения Российской Федерации от введения обязательного ЕГЭ по иностранному языку;
2021-01-04,,Возобновление обогащения урана Ираном на уровне 20 % на ядерном полигоне Фордо;
2021-01-04,,Открытие границы Катара и Саудовской Аравии;
2021-01-04,,"Лондонский суд постановил, что Джулиан Ассанж не может быть экстрадирован в США;"
2021-01-04,,Введение в Великобритании третьего национального локдауна (объявлено Борисом Джонсоном);
2021-01-04,,Получение компанией «Tesla» разрешения на импорт автомобилей в Израиль.
2021-01-05,,"Принятие иранским парламентом закона, обязывающего правительство уничтожить израиль к 2041 году."
2021-01-06,,"Захват здания конгресса сша сторонниками дональда трампа в вашингтоне (округ колумбия), с целью отвергнуть официальные результаты президентских выборов 2020 года и поддержать требование трампа к вице-президенту майку пенсу и конгрессу не признавать победу джо байдена на выборах 2020 года. во время штурма погибли 5 человек."
2021-01-07,,Джозеф байден избран конгрессом сша новым президентом сша.
2021-01-08,,Социальная сеть «twitter» заблокировала аккаунт дональда трампа.
2021-01-09,,Крушение boeing 737 авиакомпании «sriwijaya air» в яванском море.
2021-01-10,,Проведение президентских выборов и конституционного референдума в Кыргызстане;
2021-01-10,,Проведение парламентских выборов в Казахстане.
2021-01-12,,Полное отключение разработчиком функций «adobe flash player».
2021-01-13,,"Палата представителей сша проголосовала за импичмент дональда трампа за подстрекание к «вооружённому восстанию против америки». тем самым трамп стал первым президентом в истории страны, которому дважды объявили импичмент."
2021-01-14,,Проведение всеобщих выборов в уганде.
2021-01-15,,Выход России из «Договора по открытому небу»;
2021-01-15,,Википедии исполнилось 20 лет;
2021-01-15,,Уход Правительства Нидерландов в отставку.
2021-01-20,,Вступление джо байдена в должность президента сша.
2021-01-23,,Проведение протестов в поддержку алексея навального в российских городах.
2021-01-24,,Переизбрание марселу ребелу де соуза на пост президента португалии на второй срок.
2021-01-26,,Количество подтверждённых случаев заболевания covid-19 в мире превысило 100 миллионов человек.
2021-01-28,,Вступление садыра жапарова в должность президента кыргызстана.
2021-01-29,,"Подписание президентом россии владимиром путиным закона о ратификации соглашения, продлевающего на пять лет действие «снв-3»."
2021-02-01,,"Объявление вооружёнными силами мьянмы чрезвычайного положения. задержание президента мьянмы вин мьина, а также государственного советника мьянмы и лидера правящей национальной лиги за демократию аун сан су чжи."
2021-02-02,,"Джефф безос заявил об уходе с поста директора «amazon» в третьем квартале текущего года, предложив в качестве нового директора эндрю джесси."
2021-02-03,,"Канада стала первой страной в мире, объявившей «proud boys» террористической организацией."
2021-02-09,,"Успешный выход межпланетной станции «аль-амаль» («надежда»), созданной в объединённых арабских эмиратах, на орбиту марса."
2021-02-13,,Вступление марио драги в должность председателя совета министров италии. окончание правительственного кризиса в стране.
2021-02-18,,Посадка марсохода «персевирэнс» на марс.
2021-02-26,,"Американские ввс по приказу президента джо байдена нанесли серию авиаударов по территории сирии. целью ударов стали склады, принадлежащие группировке «катаиб хезболла» и некоторым другим, которые поддерживает иран."
2021-03-05,,"Молдова стала первой страной в европе, которая получила вакцины против коронавируса через инициативу «covax»."
2021-03-07,,"На референдуме в швейцарии более 51 % проголосовавших одобрили общенациональный запрет на ношение бурки. швейцария стала 7-й страной в европе, которая запретила ношение бурки, после австрии, дании, франции, бельгии, латвии и болгарии."
2021-03-15,2021-03-17,проведение парламентских выборов в Палату представителей в Нидерландах.
2021-03-23,,Проведение досрочных парламентских выборов в Израиле;
2021-03-23,,Авария контейнеровоза «Ever Given» в Суэцком канале.
2021-04-01,,"После правительственного кризиса в словакии, премьер-министром в стране назначен эдуард хегер."
2021-04-02,,В уезде хуалянь на тайване после столкновения с автокраном сошёл с рельсов пассажирский поезд. погиб 51 человек.
2021-04-04,,Избрание парламентом вьетнама президента страны нгуен суан фука.
2021-04-09,,"Смерть принца филиппа, консорта елизаветы ii."
2021-04-11,,Проведение референдума по вопросу смены конституции Кыргызстана;
2021-04-11,,Проведение президентских и парламентских выборов в Перу;
2021-04-11,,Проведение президентских выборов в Чаде.
2021-04-15,,Суд в париже заочно приговорил белоруса юрия сушкина и ивуарийцев патриса уея и анжелу маглуара гнандуйе аттуали к пожизненному заключению за убийство французских военных в кот-д’ивуаре.
2021-04-18,,Рауль кастро покинул пост первого секретаря коммунистической партии кубы.
2021-04-20,,Президент чада идрис деби скончался в больнице после ранения в результате нападения отряда повстанцев на правительственные войска.
2021-04-21,,Проведение протестных акций в российских городах в поддержку Алексея Навального;
2021-04-21,,Исчезновение индонезийской подводной лодки «KRI Nanggala (402)» в 95 км к северу от Бали. 24 апреля обломки лодки были обнаружены. Все 53 члена экипажа объявлены погибшими.
2021-04-22,,Количество применённых вакцин против covid-19 во всём мире составило 973 378 158.
2021-04-25,,"Премьер-министр армении никол пашинян подал в техническую отставку для проведения внеочередных выборов, при этом продолжив выполнять обязанности премьера в полном объёме."
2021-04-29,,Пограничный конфликт между Кыргызстаном и Таджикистаном;
2021-04-29,,Китай запустил базовый модуль собственной космической орбитальной станции «Тяньгун».
2021-04-30,,В результате давки в израиле погибло 45 человек.
2021-05-03,,Обрушение эстакады метро в мехико. погибли 26 человек.
2021-05-05,,Начало гражданской войны в мьянме.
2021-05-06,,"Конфликт, возникший из-за выселения нескольких арабских семей из домов, привёл в последующем к израильско-палестинскому кризису и вооружённым столкновениям между израилем и хамас."
2021-05-08,,"Взрыв бомбы возле школы в кабуле (исламская республика афганистан), в результате которого погибло не менее 85 человек и ещё 147 получили ранения."
2021-05-11,,"Стрельба в школе № 175 в казани. погибли 9 человек, 23 человека были госпитализированы."
2021-05-18,2021-05-22,"65-й конкурс песни «Евровидение» (Роттердам, Нидерланды)."
2021-05-19,,Катастрофа «як-130» в барановичах.
2021-05-23,,"Обрушение канатной дороги на горе Моттароне в Италии, в результате которого погибло 14 человек;"
2021-05-23,,Инцидент с посадкой «Boeing 737» в Минске.
2021-05-26,,Президентские выборы в сирии.
2021-06-02,,Избрание ицхака герцога президентом израиля.
2021-06-06,,Второй тур президентских выборов в перу.
2021-06-09,,Проведение президентских выборов в Монголии.
2021-06-09,,Арест российского видеоблогера Юрия Хованского (дело Хованского).
2021-06-10,,"Кольцеобразное солнечное затмение на территориях канады, гренландии и сибири."
2021-06-11,2021-07-11,Чемпионат Европы по футболу 2020.
2021-06-13,,Отставка правительства биньямина нетаньяху в израиле. новым премьер-министром назначен нафтали бенет.
2021-06-16,,Саммит россия — сша в женеве. первая встреча джо байдена и владимира путина на постах президента сша и россии.
2021-06-19,,Избрание Ибрагима Раиси президентом Ирана по итогам выборов.
2021-06-19,,"Катастрофа «L-410» в Кемеровской области: 5 погибли, 14 пострадали."
2021-06-20,,Досрочных парламентских выборов в армении. победу одержала партия никола пашиняна — «гражданский договор».
2021-06-24,,Компания «Microsoft» представила «Windows 11»;
2021-06-24,,Обрушение многоэтажного жилого дома Майами. Погибли 98 человек.
2021-07-01,,Столетие коммунистической партии китая.
2021-07-03,,Полный запрет использования одноразового неразлагающегося пластика в европе.
2021-07-05,,Началась закладка атомохода лидер.
2021-07-06,,Крушение самолёта «ан-26» на камчатке. погибли все 28 человек на борту.
2021-07-07,,Убийство президента Гаити Жовенеля Моиза при нападении на его резиденцию;
2021-07-07,,Инаугурация президента Израиля Ицхака Герцога.
2021-07-11,,Проведение досрочных парламентских выборов в Молдове. Победу одержала партия Майи Санду — «Действие и солидарность»;
2021-07-11,,Совершение суборбитального полёта британским миллиардером Ричардом Брэнсоном на ракетоплане собственной компании «Virgin Galactic»;
2021-07-11,,Начало массовых протестных акций на Кубе;
2021-07-11,,Проведение досрочных парламентских выборов в Болгарии.
2021-07-12,,"Начало серьёзных наводнений в западной и центральной европе, приведших к гибели более 200 человек. основной ущерб коснулся германии."
2021-07-14,,Вызов властями оаэ искусственных дождей и наводнений.
2021-07-17,,Первый полёт китайского многоразового суборбитального космического корабля;
2021-07-17,,Проведение многочисленных протестных акций в Иране на фоне сильнейшей за 50 лет засухи.
2021-07-20,,Первый пилотируемый суборбитальный полёт многоразового космического корабля «new shepard» компании «blue origin» c экипажем из четырёх человек.
2021-07-21,,Запуск модуля «наука» на мкс.
2021-07-23,2021-08-08,"проведение Летних Олимпийских игр 2020 в Токио, перенесённые с 2020 года из-за пандемии «COVID-19»."
2021-07-26,,Сведение российского модуля «пирс» международной космической станции с орбиты и его дальнейшее затопление в тихом океане.
2021-07-28,,Вступление педро кастильо в должность президента перу.
2021-07-31,,Крушение истребителя «су-35» над охотским морем. пилот катапультировался и остался жив.
2021-08-03,,"Смерч в тверской области: 3 человека погибли, 15 пострадали."
2021-08-06,,Утверждение правительства натальи гаврилицы в молдове.
2021-08-11,,"Установлен новый температурный рекорд для континентальной европы — + 48,8 °c (119,8 °f). рекорд зафиксирован метеорологической станцией в г. сиракузы на о. сицилия, италия."
2021-08-12,,"Взрыв автобуса в воронеже: 2 человека погибли, 26 пострадали."
2021-08-13,,Захват второго по величине города в афганистане — кандагара исламистским движением «талибан».
2021-08-14,,Крушение самолёта «Бе-200» в Турции: погибли 8 человек;
2021-08-14,,Землетрясение в Гаити. Погибло 1297 человек.
2021-08-15,,Падение кабула и передача власти в афганистане представителям исламистского движения «талибан». создание переходного правительства. ликвидация исламской республики афганистан.
2021-08-17,,Провозглашение себя и. о. президентом афганистана бывшим вице-президентом исламской республики афганистан амрулла салехом. начало формирования панджшерского сопротивления для борьбы с талибами.
2021-08-19,,Провозглашение талибами исламского эмирата афганистан.
2021-08-24,2021-09-05,проведение Летних Паралимпийских игр 2020 в Токио.
2021-08-26,,"Теракт в аэропорту кабула, в результате которого погибли 183, из которых 13 — американские военнослужащие, обеспечивающие эвакуацию людей из афганистана."
2021-08-31,,Проведение президентских выборов в эстонии. победу одержал алар карис.
2021-09-02,,Официальный выход «windows server 2022».
2021-09-05,,Военный переворот в гвинее.
2021-09-06,,Захват провинции панджшера талибами.
2021-09-08,,Утверждение Сальвадором биткойна в качестве национальной валюты;
2021-09-08,,"Взрыв газа в многоквартирном доме в Ногинске. Погибло 7 человек, 22 пострадали."
2021-09-08,,В Норильске (Красноярский край) во время межведомственных учений по защите Арктической зоны от ЧС погиб глава МЧС России Евгений Зиничев
2021-09-13,,Проведение парламентских выборов в норвегии. победу одержала оппозиционная «рабочая партия». правящая «консервативная партия» заняла второе место.
2021-09-15,,"Создание трёхстороннего военного альянса «aukus» между австралией, великобританией и сша."
2021-09-19,,"Извержение вулкана кумбре-вьеха на острове пальма (канарские острова, испания)."
2021-09-17,2021-09-19,проведение выборов в Государственную думу. Единый день голосования в России.
2021-09-20,,"Массовое убийство в Пермском государственном университете. Погибло 6 человек, 43 пострадали;"
2021-09-20,,"Проведение всемирного конгресса по пчеловодству Международной федерации пчеловодческих ассоциаций Апимондии (Уфа, Республика Башкортостан, Россия);"
2021-09-20,,Проведение парламентских выборов в Канаде. Победу одержала партия Джастина Трюдо — «Либеральная партия».
2021-09-25,,"Проведение парламентских выборов в исландии. победу одержала «партия независимости», набравшая более 24 % голосов."
2021-09-26,,"Проведение референдума в Швейцарии о легализации однополых браков, которые были одобрены большинством граждан."
2021-09-26,,Проведение очередных парламентских выборов в Германии. Победу одержала «Социал-демократическая партия». Правящий консервативный блок «ХДС/ХСС» занял второе место.
2021-09-28,,"Ликвидация «зон, свободных от ЛГБТ» в Польше;"
2021-09-28,,Перестрелка гражданина Республики Беларусь с органами КГБ при проверке дома и граждан по делу об экстремизме. 1 сотрудник КГБ и стрелявший убиты.
2021-10-01,,Проведение всемирной выставки 2020 в дубае (оаэ).
2021-10-02,,Проведение в грузии первого тура местных выборов.
2021-10-03,,Публикация организацией «cpi» документов «архив пандоры».
2021-10-04,,Отставка премьер-министра Японии Ёсихидэ Суга. Новым премьер-министром Японии назначен Фумио Кисида;
2021-10-04,,"Крупнейший с 2007 года сбой в самых распространённых социальных сетях и мессенджерах («WhatsApp», «Facebook», «Amazon», «Twitter», «Google», «TikTok», «Instagram» и «ВКонтакте»)."
2021-10-05,,Выход первой версии «Windows 11».
2021-10-05,,Запуск космического корабля «Союз МС-19» для отправки на МКС команды Первого канала для съёмок фильма «Вызов».
